{
  "description": "PodList is a list of Pods.",
  "$schema": "http://json-schema.org/schema#",
  "required": [
    "items"
  ],
  "type": "object",
  "properties": {
    "apiVersion": {
      "description": "APIVersion defines the versioned schema of this representation of an object. Servers should convert recognized schemas to the latest internal value, and may reject unrecognized values. More info: https://git.k8s.io/community/contributors/devel/sig-architecture/api-conventions.md#resources",
      "enum": [
        "v1"
      ],
      "type": [
        "string",
        "null"
      ]
    },
    "items": {
      "description": "List of pods. More info: https://git.k8s.io/community/contributors/devel/sig-architecture/api-conventions.md",
      "items": {
        "$ref": "./_definitions.json#/definitions/io.k8s.api.core.v1.Pod"
      },
      "type": [
        "array",
        "null"
      ]
    },
    "kind": {
      "description": "Kind is a string value representing the REST resource this object represents. Servers may infer this from the endpoint the client submits requests to. Cannot be updated. In CamelCase. More info: https://git.k8s.io/community/contributors/devel/sig-architecture/api-conventions.md#types-kinds",
      "enum": [
        "PodList"
      ],
      "type": [
        "string",
        "null"
      ]
    },
    "metadata": {
      "$ref": "./_definitions.json#/definitions/io.k8s.apimachinery.pkg.apis.meta.v1.ListMeta",
      "description": "Standard list metadata. More info: https://git.k8s.io/community/contributors/devel/sig-architecture/api-conventions.md#types-kinds"
    }
  },
  "x-kubernetes-group-version-kind": [
    {
      "group": "",
      "kind": "PodList",
      "version": "v1"
    }
  ]
}